{"schema_version":"1.4","forecast_origin":"2026-10","data_up_to":"2026-08","model_version":"1","countries":[{"id":"burkina-faso","name":"Burkina Faso","currency":"XOF","series":298,"series_with_forecast":290,"markets":63,"status_counts":{"normal":284,"stress":6,"alert":0,"crisis":0},"last_observed_month":"2026-08","reference_month":"2026-08","far_above_usual":15,"silent_markets":[{"market_id":3384,"market":"Markoye","admin1":"SAHEL","months":6,"last_reported_month":"2026-02"}]},{"id":"burundi","name":"Burundi","currency":"BIF","series":417,"series_with_forecast":374,"markets":70,"status_counts":{"normal":362,"stress":12,"alert":0,"crisis":0},"last_observed_month":"2026-08","reference_month":"2026-08","far_above_usual":7,"silent_markets":[]},{"id":"mali","name":"Mali","currency":"XOF","series":467,"series_with_forecast":243,"markets":103,"status_counts":{"normal":239,"stress":3,"alert":1,"crisis":0},"last_observed_month":"2026-08","reference_month":"2026-08","far_above_usual":7,"silent_markets":[{"market_id":2025,"market":"Diondiori","admin1":"Mopti","months":19,"last_reported_month":"2025-01"},{"market_id":2029,"market":"Kikara","admin1":"Mopti","months":19,"last_reported_month":"2025-01"},{"market_id":3637,"market":"Ber","admin1":"Tombouctou","months":10,"last_reported_month":"2025-10"},{"market_id":2024,"market":"Diafarabé","admin1":"Mopti","months":8,"last_reported_month":"2025-12"},{"market_id":871,"market":"Djenne","admin1":"Mopti","months":8,"last_reported_month":"2025-12"},{"market_id":2027,"market":"Gathi Loumo","admin1":"Mopti","months":8,"last_reported_month":"2025-12"},{"market_id":895,"market":"Nara","admin1":"Koulikoro","months":8,"last_reported_month":"2025-12"},{"market_id":2031,"market":"Tenenkou","admin1":"Mopti","months":8,"last_reported_month":"2025-12"},{"market_id":2517,"market":"Amachach","admin1":"Kidal","months":4,"last_reported_month":"2026-04"},{"market_id":2521,"market":"Échelle","admin1":"Tombouctou","months":4,"last_reported_month":"2026-04"},{"market_id":2036,"market":"Gounanbougou","admin1":"Tombouctou","months":3,"last_reported_month":"2026-05"},{"market_id":2518,"market":"Annefif","admin1":"Kidal","months":2,"last_reported_month":"2026-06"},{"market_id":3640,"market":"Gossi","admin1":"Tombouctou","months":2,"last_reported_month":"2026-06"},{"market_id":250,"market":"Kidal","admin1":"Kidal","months":2,"last_reported_month":"2026-06"},{"market_id":2023,"market":"Tessalit","admin1":"Kidal","months":2,"last_reported_month":"2026-06"}]}],"attribution":"Source: World Food Programme (WFP), food prices via the Humanitarian Data Exchange (HDX), CC BY-IGO."}